{"cleanup_status":"succeeded","created_at":"2026-10-07T04:51:18.109Z","execution_manifest_sha256":"03586029b4faa11c0f4c14cc7ea0ad291b0afa25036c91639f97d02a35979a54","late_evidence_assessment_ref":{"artifact_path":"late-evidence/late-evidence-assessment.json","artifact_sha256":"ec5af4629227adc7fbb34c605d20bb4f877473e6d10c373b25cb38e5dc6f3847"},"late_evidence_status":"none","leak_audit_status":"clean","lease_status":"released","probe_result_sha256":"05ffc0d504fbef148b6156e40ce905466fdb87b70bcb1d04ac72ee75f8d143c1","probe_terminal_reason":"COMPLETED","record_type":"transport_probe_summary","safety_status":"within_limits","schema_version":1,"transport_probe_id":"adfca539-508f-4a51-9a98-e1dcf8cec84a"}
