{"cleanup_status":"succeeded","created_at":"2026-10-07T03:58:35.418Z","execution_manifest_sha256":"a1fd75394f2597338ef92b3c3bd946ac15aeb4aa34f1557e1ed54505c0111a4c","late_evidence_assessment_ref":{"artifact_path":"late-evidence/late-evidence-assessment.json","artifact_sha256":"ac59f8e806783f3d0f217e2b7b2ea0f7191fb8aa4461a1dba027463add194549"},"late_evidence_status":"none","leak_audit_status":"inconclusive","lease_status":"recovery_required","probe_result_sha256":"b76f05fbfad33fa6d2999d83c80458a7dc83b5d89eb9439e558d72663b47a9f7","probe_terminal_reason":"LEAK_AUDIT_NOT_CLEAN","record_type":"transport_probe_summary","safety_status":"within_limits","schema_version":1,"transport_probe_id":"4f4a29c7-a8ee-4d30-ac2a-5cc5be9f2ce5"}
